id,name,description
joe-biden,Joe Biden,Tokens that are related to Joe Biden
sei-pun,Sei Pun,"Puns with the sound ""Sei"""
audio-tokens,Audio Tokens,"TON tokens that has audio attached to it, and launched on GasPump."
ape,Ape,Tokens related to the great apes 
elon,Elon,Things and Brands related to Elon Musk
urban-dictionary,Urban Dictionary,Tokens that use abbreviations and slangs we use in real life.
hamster,Hamster,"As requested by the community, here are the crypto hamsters"
animal,Animal,Tokens that are related to any types of animals
religion,Religion,Tokens that are related to religious vocabularies.
inu,Inu,"Tokens related to Inu or has the name ""Inu"""
sticker,Sticker,Stickers used in chat apps.
girl,Girl,Tokens related to females especially younger women/ girls
fashion,Fashion,Brands that are related to fashion and clothing.
wojak,Wojak,"Tokens inspired by the 'Wojak' or 'Feels Guy' character. These projects leverage the meme's long-standing history in internet culture to reflect the highs and lows of the crypto market, often focusing on themes of community, empathy, and trading sentiment."
color,Color,Crypto Tokens that has a colour in the name or ticker.
reddit,Reddit,"Crypto tokens related to reddit and its mascot. This category is automatically updated with any ""reddit"" token."
anime,Anime,Tokens that are related to Japanese cartoons or anime
astrology,Astrology,Crypto tokens that are related to astrology signs like Sagittarius or Virgo.
tokenized-stocks,Tokenized Stocks,Tokenized stock refers to digital representation of stock on a blockchain platform.
floki,Floki,"Tokens related to Elon Musk's shiba inu dog, named Floki."
district-launchpad,District Launchpad,Tokens launched from the District Launchpad. (https://www.district.xyz/)
us-presidential-election-2024,Us Presidential Election 2024,"Tokens related to US presidential candidates, primarily Trump vs Biden."
donald-trump,Donald Trump,Tokens related to Donald Trump
believeapp-launchpad,Believeapp Launchpad,Tokens launched from Believe.app (https://x.com/believeapp). 
in-a-something,In A Something,"Crypto tokens that has something inside a something, usually an animal in a vehicle."
kabosu-family,Kabosu Family,"Crypto Tokens related to Kabosu, a Shiba Inu dog from Japan known as the Doge meme. This category tracks all Neiro, Kabosu and Ginnan tokens."
nftstrategy,Nftstrategy,"NFTStrategy automatically buys and lists floor NFTs for a profit, using the trading fees generated by the tokens.."
justice-themed,Justice Themed,Tokens that are made to bring social justice.
fruits,Fruits,"An apple a day keeps the doctor away, what about other fruits?"
countries,Countries,Tokens that are relevant to country names and places.
ai,Ai,"Tokens related to Artificial Intelligience, Machine Learning and LLMs."
binance-exclusive,Binance Exclusive,Tokens that are launched from Binance Wallet Exclusive launchpad. These tokens can only be traded using Binance wallet before they graduate from the bonding curve.
gently-used,Gently Used,gently used things
cat,Cat,Tokens with a cat
founders,Founders,Crypto tokens that are related to founders of products and startups.
ghibli-themed,Ghibli Themed,"Tokens has Studio Ghibli themed style artwork. Recent AI advancement has made the iconic Studio Ghibli animation style available through AI image generation, which led to a viral trend on social media."
andrew-tate,Andrew Tate,Crypto tokens that are related to daddy Andrew Tate.
cup,Cup,Tokens that are related to cups and mugs.
daosfun-launchpad,Daosfun Launchpad,Daos.fun is a launchpad for a creator-funded smart wallet with special rules that invests on behalf of DAO token holders.
commodities,Commodities,"Crypto tokens and pools that are related to commodities in real life, like Gold, Silver and Diamond."
baby,Baby,Tokens that are figuratively small... but mighty
prestocks,Prestocks,"PreStocks are tokens that track the valuation of pre-IPO companies.  Fully backed by SPV exposure, and freely tradable 24/7."
mcdonalds,Mcdonalds,"Tokens that are related to McDonalds, a fast food chain."
farcaster,Farcaster,"Farcaster does not have an official token, but there are so many tokens created through Farcaster, here are your choices."
metadao-launchpad,Metadao Launchpad,All tokens that launched from Metadao's ICO program.
zora-content,Zora Content,Tokens that are tokenized on Zora for a social content.
wall-street-bets,Wall Street Bets,Tokens that pay homage to the r/wallstreetbets community.
zora-creator,Zora Creator,Tokens that are tokenized on Zora for a creator.
chains,Chains,Crypto Tokens that has a ticker similar to other chains.
deep-web,Deep Web,Tokens related to Deep Web
doge,Doge,Tokens that are related to Doge the original meme.
creatorbid-launchpad,Creatorbid Launchpad,Creator.bid is a launchpad that allows you to create and tokenize AI agents on Base.
whale,Whale,All types of whale tokens. This category is automatically updated with the latest whale tokens.
ascii,Ascii,"Crypto tokens that have ascii symbols as tickers or names. Not limited to Japanese Kaomojis, emojis or ascii art."
murad-picks,Murad Picks,"This list features the top token picks by @MustStopMurad, a memecoin influencer. (See more at https://x.com/MustStopMurad/status/1845204492414791870)"
presale,Presale,Crypto tokens that had a presale event to raise funds.
bonk-flippers,Bonk Flippers,"Crypto Tokens that are Bonk alternatives, or competing with Bonk."
trading-card-game,Trading Card Game,Tokens related to the trading card game meta.
virtuals-protocol,Virtuals Protocol,Crypto tokens that were minted from Virtuals Protocol. Virtuals Protocol is building the co-ownership layer for AI agents in gaming and entertainment.
milady,Milady,Crypto tokens that are related to Milady Maker or spinoffs counterparts.
influencer,Influencer,Tokens that are related to named after Twitter KOLs or Influencers.
social-experiments,Social Experiments,Crypto tokens that launched with a unique way of experimenting with the community.
cto,Cto,Tokens that are approved of Community takeover (CTO) on Geckoterminal.
basedotmeme-launchpad,Basedotmeme Launchpad,Tokens launched from base.meme launchpad. (https://base.meme/)
the-boys-club,The Boys Club,"Tokens that are related to the members of The Boys Club by Matt Furie. Including Pepe, Brett, Andy and Landwolf."
letsbonkfun-launchpad,Letsbonkfun Launchpad,"Tokens launched from the letsbonkfun launchpad, https://letsbonk.fun/."
chicken,Chicken,Tokens related to chicken
fictional-character,Fictional Character,"Tokens related to fictional characters from movies, comics, books etc. "
japanese,Japanese,"Crypto tokens that has a japanese ticker, or a relevance to japanese culture."
chill,Chill,"Its okay, these crypto tokens are just chill tokens."
pump-fun,Pump Fun,Crypto tokens that were minted from Pump.fun. Pump.fun is a platform for token fair-launches with no presale and no team allocation. This list is automatically updated for all latest graduated Pump.fun tokens.
dog,Dog,All types of dog tokens. This category is automatically updated with the latest dog tokens.
wallet,Wallet,Crypto tokens that are related to wallets.
flaunch-launchpad,Flaunch Launchpad,Tokens launched from the flaunch launchpad. (https://flaunch.gg/)
perpetuals-platforms,Perpetuals Platforms,Tokens that are related to perpetual platforms that allows traders to speculate and take leveraged positions on the underlying asset prices indefinitely.
bots,Bots,"Tokens that are related to bots, like Telegram, Discord or Crypto Sniping Bots."
chinese,Chinese,"Tokens that has a Chinese ticker, or translation and relevance."
psyop-anime,Psyop Anime,Tokens associated with the 'Psyop Anime' trend. Characterized by the fusion of anime aesthetics—often AI-generated—with satirical commentary on global news and market events.
numbers,Numbers,"Crypto tokens inspired by internet subcultures and number-based wordplay. These projects utilize viral numerical sequences, such as 114514 and 45470, to foster shared identity and signaling through niche online humor and cultural symbolism."
fourmeme-launchpad,Fourmeme Launchpad,Tokens launched on four.meme launchpad. 
autofun-launchpad,Autofun Launchpad,"Tokens launched from auto.fun launchpad, by the ElizaOS team."
goat,Goat,Crypto tokens that are related to goats.
gaming,Gaming,tokens related to gaming projects.
dao,Dao,Crypto tokens that are related to DAOs (Decentralised Autonomous Organisations).
meme,Meme,Tokens that are memes or related to meme images.
nmurad-picks,Nmurad Picks,"This list features the top token picks by @muststopnigg, a memecoin influencer. (See more at https://x.com/muststopnigg/status/1901802031465021503)"
clanker-world,Clanker World,Tokens that were created by clanker.world. Clanker.world is an autonomous memecoins machine that launches tokens on Farcaster posts.
unicorn-memechain,Unicorn Memechain,"Crypto tokens that are related to unicorn.memes, the memechain."
boopfun-launchpad,Boopfun Launchpad,Tokens launched from the boopfun token launchpad.
timefun,Timefun,Tokens launched from time.fun launchpad.
spore-fun,Spore Fun,"Tokens that were created by Spore, autonomous AI agent for token reproduction and evolution powered by the Eliza Framework, Solana pump.fun and TEE verifiable computation."
dragonball,Dragonball,
euro-2024,Euro 2024,Tokens related to the Euro 2024 football championship. 
ai-agents,Ai Agents,Crypto tokens that are related to AI agents on other platforms.
long-things,Long Things,"Crypto tokens that are longer than the rest, starts with ""long""."
terminal-of-truths,Terminal Of Truths,Tokens mentioned by the terminal of truth at https://x.com/truth_terminal
the-zoo,The Zoo,Crypto tokens that reference viral zoo animal names.
desci,Desci,"Tokens that are related to DeSci, or Decentralised Science."
trends-launchpad,Trends Launchpad,Tokens launched from Trends.fun launchpad for the capitalized information market. https://trends.fun
x402-protocol,X402 Protocol,"Projects using the x402 protocol, where AI agents can buy, sell, and pay each other without any human in the loop."
defi,Defi,"Crypto tokens that are related to DeFi projects, financial liquidity protocols or markets."
livestream,Livestream,Devs that livestreamed the token creation.
hybrid-defi,Hybrid Defi,
telegram-apps,Telegram Apps,Crypto tokens that has a telegram app.
big-tech,Big Tech,"Crypto Tokens that reference Big Tech Companies, like NVIDIA, AMD or TESLA in comical ways."
plane,Plane,Tokens that are related to airplanes and flights.
dark,Dark,Crypto tokens that have dark profile pictures.
mascot,Mascot,"Tokens with a unique mascot. This category is automatically updated with all latest ""mascot"" crypto tokens."
memechan-launchpad,Memechan Launchpad,"Crypto tokens minted from memechan, a launchpad designed to provide a seamless and efficient platform for token creators."
artist-tokens,Artist Tokens,Tokens that are created by internet artists.
simply-drawn,Simply Drawn,Crypto tokens that has mascot made with simple or abstract shapes.
archives,Archives,"Tokens that belong to projects that are archiving information, like Magazines and Books."
resistance,Resistance,Tokens related to digital resistance
sol-tech,Sol Tech,"Crypto tokens that envisions an additional layer of utility to Solana and starts with ""Sol"""
pepe,Pepe,"All tokens that has the ticker PEPE, or related to PEPE. This category is automatically updated with new PEPE tokens."
celebrity,Celebrity,Tokens with name or meme that are related or made by celebrities.
jail,Jail,The JailVerse: Where each token represents the community's battle cry against crypto's most prominent players.
someones-thing,Someones Thing,Things that are owned by popular figures.
food,Food,Tokens that are named after food.
erc404,Erc404,ERC404 is a token standard on Ethereum that combines the attributes of NFTs and fungible tokens.
nft,Nft,"Tokens that are related to NFTs, or NFT marketplaces."
with-something,With Something,"Token with something, like with hat and others"
tiktok-memes,Tiktok Memes,Crypto tokens with memes originated from TikTok or Douyin.
poorly-drawn,Poorly Drawn,"Tokens with an MS Paint style poorly-drawn version of a character, like Spooderman."
mining,Mining,"Tokens that are either proof of work, or let users get a share of their tokens with an activity."
acronym,Acronym,Crypto tokens that sounds cooler as an acronym
digital-fiat-currencies,Digital Fiat Currencies,Tokens that are relevant to crypto-inspired digital currencies of different nations.
spl22,Spl22,
sun-pump,Sun Pump,Crypto tokens that were minted from Sunpump. Sunpump.meme is a platform for token fair-launches on Tron.
strategy,Strategy,"Crypto tokens related to social experiment where platforms test out economic model where transaction fees are used to purchase NFTs from the open market, which are then relisted for sale at a higher price."
t-on-ton,T On Ton,T something that is launched on Ton