id,name,description
reddit,Reddit,"Crypto tokens related to reddit and its mascot. This category is automatically updated with any ""reddit"" token."
justice-themed,Justice Themed,Tokens that are made to bring social justice.
influencer,Influencer,Tokens that are related to named after Twitter KOLs or Influencers.
t-on-ton,T On Ton,T something that is launched on Ton
cat,Cat,Tokens with a cat
with-something,With Something,"Token with something, like with hat and others"
chill,Chill,"Its okay, these crypto tokens are just chill tokens."
long-launchpad,Long Launchpad,
spl22,Spl22,
desci,Desci,"Tokens that are related to DeSci, or Decentralised Science."
gently-used,Gently Used,gently used things
in-a-something,In A Something,"Crypto tokens that has something inside a something, usually an animal in a vehicle."
gaming,Gaming,tokens related to gaming projects.
bonk-flippers,Bonk Flippers,"Crypto Tokens that are Bonk alternatives, or competing with Bonk."
plane,Plane,Tokens that are related to airplanes and flights.
boopfun-launchpad,Boopfun Launchpad,Tokens launched from the boopfun token launchpad.
ape,Ape,Tokens related to the great apes 
ghibli-themed,Ghibli Themed,"Tokens has Studio Ghibli themed style artwork. Recent AI advancement has made the iconic Studio Ghibli animation style available through AI image generation, which led to a viral trend on social media."
jail,Jail,The JailVerse: Where each token represents the community's battle cry against crypto's most prominent players.
sun-pump,Sun Pump,Crypto tokens that were minted from Sunpump. Sunpump.meme is a platform for token fair-launches on Tron.
autofun-launchpad,Autofun Launchpad,"Tokens launched from auto.fun launchpad, by the ElizaOS team."
joe-biden,Joe Biden,Tokens that are related to Joe Biden
urban-dictionary,Urban Dictionary,Tokens that use abbreviations and slangs we use in real life.
someones-thing,Someones Thing,Things that are owned by popular figures.
founders,Founders,Crypto tokens that are related to founders of products and startups.
telegram-apps,Telegram Apps,Crypto tokens that has a telegram app.
acronym,Acronym,Crypto tokens that sounds cooler as an acronym
cup,Cup,Tokens that are related to cups and mugs.
prestocks,Prestocks,"PreStocks are tokens that track the valuation of pre-IPO companies.  Fully backed by SPV exposure, and freely tradable 24/7."
sol-tech,Sol Tech,"Crypto tokens that envisions an additional layer of utility to Solana and starts with ""Sol"""
basedotmeme-launchpad,Basedotmeme Launchpad,Tokens launched from base.meme launchpad. (https://base.meme/)
letsbonkfun-launchpad,Letsbonkfun Launchpad,"Tokens launched from the letsbonkfun launchpad, https://letsbonk.fun/."
dragonball,Dragonball,
chicken,Chicken,Tokens related to chicken
color,Color,Crypto Tokens that has a colour in the name or ticker.
pepe,Pepe,"All tokens that has the ticker PEPE, or related to PEPE. This category is automatically updated with new PEPE tokens."
taylor-swift,Taylor Swift,"Tokens related to the celebrity, Taylor Swift."
cto,Cto,Tokens that are approved of Community takeover (CTO) on Geckoterminal.
us-presidential-election-2024,Us Presidential Election 2024,"Tokens related to US presidential candidates, primarily Trump vs Biden."
numbers,Numbers,"Crypto tokens inspired by internet subcultures and number-based wordplay. These projects utilize viral numerical sequences, such as 114514 and 45470, to foster shared identity and signaling through niche online humor and cultural symbolism."
commodities,Commodities,"Crypto tokens and pools that are related to commodities in real life, like Gold, Silver and Diamond."
countries,Countries,Tokens that are relevant to country names and places.
donald-trump,Donald Trump,Tokens related to Donald Trump
arvr,Arvr,"Tokens that are related to Virtual Reality and Augmented Reality, like the Apple Vision Pro."
daosfun-launchpad,Daosfun Launchpad,Daos.fun is a launchpad for a creator-funded smart wallet with special rules that invests on behalf of DAO token holders.
celebrity,Celebrity,Tokens with name or meme that are related or made by celebrities.
opinionsfun-launchpad,Opinionsfun Launchpad,Tokens launched from Opinions.fun - a launchpad for opinion markets. (https://opinions.fun/)
harry-potter,Harry Potter,Tokens that are related to the Harry Potter book series.
1776meme-launchpad,1776meme Launchpad,"Tokens launched from https://1776.meme/, a token launchpad on Ethereum."
district-launchpad,District Launchpad,Tokens launched from the District Launchpad. (https://www.district.xyz/)
food,Food,Tokens that are named after food.
astrology,Astrology,Crypto tokens that are related to astrology signs like Sagittarius or Virgo.
fictional-character,Fictional Character,"Tokens related to fictional characters from movies, comics, books etc. "
murad-picks,Murad Picks,"This list features the top token picks by @MustStopMurad, a memecoin influencer. (See more at https://x.com/MustStopMurad/status/1845204492414791870)"
livestream,Livestream,Devs that livestreamed the token creation.
pump-fun,Pump Fun,Crypto tokens that were minted from Pump.fun. Pump.fun is a platform for token fair-launches with no presale and no team allocation. This list is automatically updated for all latest graduated Pump.fun tokens.
defi,Defi,"Crypto tokens that are related to DeFi projects, financial liquidity protocols or markets."
sticker,Sticker,Stickers used in chat apps.
x402-protocol,X402 Protocol,"Projects using the x402 protocol, where AI agents can buy, sell, and pay each other without any human in the loop."
unicorn-memechain,Unicorn Memechain,"Crypto tokens that are related to unicorn.memes, the memechain."
chains,Chains,Crypto Tokens that has a ticker similar to other chains.
ai-agents,Ai Agents,Crypto tokens that are related to AI agents on other platforms.
wow-launchpad,Wow Launchpad,Tokens that graduated from the wow.xyz launchpad. Wow.xyz is a protocol that allows users to create and interact with meme tokens.
wallet,Wallet,Crypto tokens that are related to wallets.
meme,Meme,Tokens that are memes or related to meme images.
elon,Elon,Things and Brands related to Elon Musk
farcaster,Farcaster,"Farcaster does not have an official token, but there are so many tokens created through Farcaster, here are your choices."
clanker-world,Clanker World,Tokens that were created by clanker.world. Clanker.world is an autonomous memecoins machine that launches tokens on Farcaster posts.
inu,Inu,"Tokens related to Inu or has the name ""Inu"""
memechan-launchpad,Memechan Launchpad,"Crypto tokens minted from memechan, a launchpad designed to provide a seamless and efficient platform for token creators."
doge,Doge,Tokens that are related to Doge the original meme.
creatorbid-launchpad,Creatorbid Launchpad,Creator.bid is a launchpad that allows you to create and tokenize AI agents on Base.
chinese,Chinese,"Tokens that has a Chinese ticker, or translation and relevance."
zora-content,Zora Content,Tokens that are tokenized on Zora for a social content.
tiktok-memes,Tiktok Memes,Crypto tokens with memes originated from TikTok or Douyin.
andrew-tate,Andrew Tate,Crypto tokens that are related to daddy Andrew Tate.
bots,Bots,"Tokens that are related to bots, like Telegram, Discord or Crypto Sniping Bots."
artist-tokens,Artist Tokens,Tokens that are created by internet artists.
animal,Animal,Tokens that are related to any types of animals
dao,Dao,Crypto tokens that are related to DAOs (Decentralised Autonomous Organisations).
goat,Goat,Crypto tokens that are related to goats.
virtuals-protocol,Virtuals Protocol,Crypto tokens that were minted from Virtuals Protocol. Virtuals Protocol is building the co-ownership layer for AI agents in gaming and entertainment.
baby,Baby,Tokens that are figuratively small... but mighty
nmurad-picks,Nmurad Picks,"This list features the top token picks by @muststopnigg, a memecoin influencer. (See more at https://x.com/muststopnigg/status/1901802031465021503)"
believeapp-launchpad,Believeapp Launchpad,Tokens launched from Believe.app (https://x.com/believeapp). 
kabosu-family,Kabosu Family,"Crypto Tokens related to Kabosu, a Shiba Inu dog from Japan known as the Doge meme. This category tracks all Neiro, Kabosu and Ginnan tokens."
finance-giants,Finance Giants,Tokens that are related to big financial institutions.
nft,Nft,"Tokens that are related to NFTs, or NFT marketplaces."
erc404,Erc404,ERC404 is a token standard on Ethereum that combines the attributes of NFTs and fungible tokens.
religion,Religion,Tokens that are related to religious vocabularies.
hybrid-defi,Hybrid Defi,
the-zoo,The Zoo,Crypto tokens that reference viral zoo animal names.
wall-street-bets,Wall Street Bets,Tokens that pay homage to the r/wallstreetbets community.
metadao-launchpad,Metadao Launchpad,All tokens that launched from Metadao's ICO program.
zora-creator,Zora Creator,Tokens that are tokenized on Zora for a creator.
presale,Presale,Crypto tokens that had a presale event to raise funds.
ai,Ai,"Tokens related to Artificial Intelligience, Machine Learning and LLMs."
japanese,Japanese,"Crypto tokens that has a japanese ticker, or a relevance to japanese culture."
mascot,Mascot,"Tokens with a unique mascot. This category is automatically updated with all latest ""mascot"" crypto tokens."
hamster,Hamster,"As requested by the community, here are the crypto hamsters"
social-experiments,Social Experiments,Crypto tokens that launched with a unique way of experimenting with the community.
milady,Milady,Crypto tokens that are related to Milady Maker or spinoffs counterparts.
perpetuals-platforms,Perpetuals Platforms,Tokens that are related to perpetual platforms that allows traders to speculate and take leveraged positions on the underlying asset prices indefinitely.
fourmeme-launchpad,Fourmeme Launchpad,Tokens launched on four.meme launchpad. 
anime,Anime,Tokens that are related to Japanese cartoons or anime
terminal-of-truths,Terminal Of Truths,Tokens mentioned by the terminal of truth at https://x.com/truth_terminal
ascii,Ascii,"Crypto tokens that have ascii symbols as tickers or names. Not limited to Japanese Kaomojis, emojis or ascii art."
flaunch-launchpad,Flaunch Launchpad,Tokens launched from the flaunch launchpad. (https://flaunch.gg/)
girl,Girl,Tokens related to females especially younger women/ girls
nftstrategy,Nftstrategy,"NFTStrategy automatically buys and lists floor NFTs for a profit, using the trading fees generated by the tokens.."
fashion,Fashion,Brands that are related to fashion and clothing.
verb,Verb,"Tokens with name of the english language describing an action, state, or occurrence."
psyop-anime,Psyop Anime,Tokens associated with the 'Psyop Anime' trend. Characterized by the fusion of anime aesthetics—often AI-generated—with satirical commentary on global news and market events.
wojak,Wojak,"Tokens inspired by the 'Wojak' or 'Feels Guy' character. These projects leverage the meme's long-standing history in internet culture to reflect the highs and lows of the crypto market, often focusing on themes of community, empathy, and trading sentiment."
archives,Archives,"Tokens that belong to projects that are archiving information, like Magazines and Books."
mining,Mining,"Tokens that are either proof of work, or let users get a share of their tokens with an activity."
the-boys-club,The Boys Club,"Tokens that are related to the members of The Boys Club by Matt Furie. Including Pepe, Brett, Andy and Landwolf."
floki,Floki,"Tokens related to Elon Musk's shiba inu dog, named Floki."
fruits,Fruits,"An apple a day keeps the doctor away, what about other fruits?"
long-things,Long Things,"Crypto tokens that are longer than the rest, starts with ""long""."
big-tech,Big Tech,"Crypto Tokens that reference Big Tech Companies, like NVIDIA, AMD or TESLA in comical ways."
tokenized-stocks,Tokenized Stocks,Tokenized stock refers to digital representation of stock on a blockchain platform.
digital-fiat-currencies,Digital Fiat Currencies,Tokens that are relevant to crypto-inspired digital currencies of different nations.
resistance,Resistance,Tokens related to digital resistance
trading-card-game,Trading Card Game,Tokens related to the trading card game meta.
mcdonalds,Mcdonalds,"Tokens that are related to McDonalds, a fast food chain."
timefun,Timefun,Tokens launched from time.fun launchpad.
poorly-drawn,Poorly Drawn,"Tokens with an MS Paint style poorly-drawn version of a character, like Spooderman."
dog,Dog,All types of dog tokens. This category is automatically updated with the latest dog tokens.
deep-web,Deep Web,Tokens related to Deep Web
audio-tokens,Audio Tokens,"TON tokens that has audio attached to it, and launched on GasPump."
dark,Dark,Crypto tokens that have dark profile pictures.
whale,Whale,All types of whale tokens. This category is automatically updated with the latest whale tokens.
sei-pun,Sei Pun,"Puns with the sound ""Sei"""
spore-fun,Spore Fun,"Tokens that were created by Spore, autonomous AI agent for token reproduction and evolution powered by the Eliza Framework, Solana pump.fun and TEE verifiable computation."
simply-drawn,Simply Drawn,Crypto tokens that has mascot made with simple or abstract shapes.
trends-launchpad,Trends Launchpad,Tokens launched from Trends.fun launchpad for the capitalized information market. https://trends.fun
binance-exclusive,Binance Exclusive,Tokens that are launched from Binance Wallet Exclusive launchpad. These tokens can only be traded using Binance wallet before they graduate from the bonding curve.
euro-2024,Euro 2024,Tokens related to the Euro 2024 football championship. 
strategy,Strategy,"Crypto tokens related to social experiment where platforms test out economic model where transaction fees are used to purchase NFTs from the open market, which are then relisted for sale at a higher price."
kamala-harris,Kamala Harris,Tokens related to Kamala Harris
olympics,Olympics,Tokens related to the Olympic Games.
minecraft,Minecraft,Crypto tokens that are related to minecraft games.