id,name,description
trends-launchpad,Trends Launchpad,Tokens launched from Trends.fun launchpad for the capitalized information market. https://trends.fun
long-launchpad,Long Launchpad,
sei-pun,Sei Pun,"Puns with the sound ""Sei"""
cat,Cat,Tokens with a cat
plane,Plane,Tokens that are related to airplanes and flights.
timefun,Timefun,Tokens launched from time.fun launchpad.
justice-themed,Justice Themed,Tokens that are made to bring social justice.
unicorn-memechain,Unicorn Memechain,"Crypto tokens that are related to unicorn.memes, the memechain."
animal,Animal,Tokens that are related to any types of animals
long-things,Long Things,"Crypto tokens that are longer than the rest, starts with ""long""."
ghibli-themed,Ghibli Themed,"Tokens has Studio Ghibli themed style artwork. Recent AI advancement has made the iconic Studio Ghibli animation style available through AI image generation, which led to a viral trend on social media."
spore-fun,Spore Fun,"Tokens that were created by Spore, autonomous AI agent for token reproduction and evolution powered by the Eliza Framework, Solana pump.fun and TEE verifiable computation."
doge,Doge,Tokens that are related to Doge the original meme.
ascii,Ascii,"Crypto tokens that have ascii symbols as tickers or names. Not limited to Japanese Kaomojis, emojis or ascii art."
hamster,Hamster,"As requested by the community, here are the crypto hamsters"
baby,Baby,Tokens that are figuratively small... but mighty
ai,Ai,"Tokens related to Artificial Intelligience, Machine Learning and LLMs."
urban-dictionary,Urban Dictionary,Tokens that use abbreviations and slangs we use in real life.
anime,Anime,Tokens that are related to Japanese cartoons or anime
boopfun-launchpad,Boopfun Launchpad,Tokens launched from the boopfun token launchpad.
memechan-launchpad,Memechan Launchpad,"Crypto tokens minted from memechan, a launchpad designed to provide a seamless and efficient platform for token creators."
dog,Dog,All types of dog tokens. This category is automatically updated with the latest dog tokens.
japanese,Japanese,"Crypto tokens that has a japanese ticker, or a relevance to japanese culture."
resistance,Resistance,Tokens related to digital resistance
elon,Elon,Things and Brands related to Elon Musk
ape,Ape,Tokens related to the great apes 
dao,Dao,Crypto tokens that are related to DAOs (Decentralised Autonomous Organisations).
dragonball,Dragonball,
trading-card-game,Trading Card Game,Tokens related to the trading card game meta.
x402-protocol,X402 Protocol,"Projects using the x402 protocol, where AI agents can buy, sell, and pay each other without any human in the loop."
farcaster,Farcaster,"Farcaster does not have an official token, but there are so many tokens created through Farcaster, here are your choices."
ai-agents,Ai Agents,Crypto tokens that are related to AI agents on other platforms.
wojak,Wojak,"Tokens inspired by the 'Wojak' or 'Feels Guy' character. These projects leverage the meme's long-standing history in internet culture to reflect the highs and lows of the crypto market, often focusing on themes of community, empathy, and trading sentiment."
big-tech,Big Tech,"Crypto Tokens that reference Big Tech Companies, like NVIDIA, AMD or TESLA in comical ways."
us-presidential-election-2024,Us Presidential Election 2024,"Tokens related to US presidential candidates, primarily Trump vs Biden."
donald-trump,Donald Trump,Tokens related to Donald Trump
letsbonkfun-launchpad,Letsbonkfun Launchpad,"Tokens launched from the letsbonkfun launchpad, https://letsbonk.fun/."
tiktok-memes,Tiktok Memes,Crypto tokens with memes originated from TikTok or Douyin.
binance-exclusive,Binance Exclusive,Tokens that are launched from Binance Wallet Exclusive launchpad. These tokens can only be traded using Binance wallet before they graduate from the bonding curve.
food,Food,Tokens that are named after food.
autofun-launchpad,Autofun Launchpad,"Tokens launched from auto.fun launchpad, by the ElizaOS team."
the-boys-club,The Boys Club,"Tokens that are related to the members of The Boys Club by Matt Furie. Including Pepe, Brett, Andy and Landwolf."
the-zoo,The Zoo,Crypto tokens that reference viral zoo animal names.
sol-tech,Sol Tech,"Crypto tokens that envisions an additional layer of utility to Solana and starts with ""Sol"""
mascot,Mascot,"Tokens with a unique mascot. This category is automatically updated with all latest ""mascot"" crypto tokens."
milady,Milady,Crypto tokens that are related to Milady Maker or spinoffs counterparts.
color,Color,Crypto Tokens that has a colour in the name or ticker.
district-launchpad,District Launchpad,Tokens launched from the District Launchpad. (https://www.district.xyz/)
religion,Religion,Tokens that are related to religious vocabularies.
meme,Meme,Tokens that are memes or related to meme images.
cup,Cup,Tokens that are related to cups and mugs.
livestream,Livestream,Devs that livestreamed the token creation.
kamala-harris,Kamala Harris,Tokens related to Kamala Harris
fourmeme-launchpad,Fourmeme Launchpad,Tokens launched on four.meme launchpad. 
someones-thing,Someones Thing,Things that are owned by popular figures.
numbers,Numbers,"Crypto tokens inspired by internet subcultures and number-based wordplay. These projects utilize viral numerical sequences, such as 114514 and 45470, to foster shared identity and signaling through niche online humor and cultural symbolism."
artist-tokens,Artist Tokens,Tokens that are created by internet artists.
metadao-launchpad,Metadao Launchpad,All tokens that launched from Metadao's ICO program.
archives,Archives,"Tokens that belong to projects that are archiving information, like Magazines and Books."
psyop-anime,Psyop Anime,Tokens associated with the 'Psyop Anime' trend. Characterized by the fusion of anime aesthetics—often AI-generated—with satirical commentary on global news and market events.
creatorbid-launchpad,Creatorbid Launchpad,Creator.bid is a launchpad that allows you to create and tokenize AI agents on Base.
acronym,Acronym,Crypto tokens that sounds cooler as an acronym
desci,Desci,"Tokens that are related to DeSci, or Decentralised Science."
chicken,Chicken,Tokens related to chicken
bonk-flippers,Bonk Flippers,"Crypto Tokens that are Bonk alternatives, or competing with Bonk."
pump-fun,Pump Fun,Crypto tokens that were minted from Pump.fun. Pump.fun is a platform for token fair-launches with no presale and no team allocation. This list is automatically updated for all latest graduated Pump.fun tokens.
taylor-swift,Taylor Swift,"Tokens related to the celebrity, Taylor Swift."
harry-potter,Harry Potter,Tokens that are related to the Harry Potter book series.
telegram-apps,Telegram Apps,Crypto tokens that has a telegram app.
whale,Whale,All types of whale tokens. This category is automatically updated with the latest whale tokens.
flaunch-launchpad,Flaunch Launchpad,Tokens launched from the flaunch launchpad. (https://flaunch.gg/)
inu,Inu,"Tokens related to Inu or has the name ""Inu"""
believeapp-launchpad,Believeapp Launchpad,Tokens launched from Believe.app (https://x.com/believeapp). 
poorly-drawn,Poorly Drawn,"Tokens with an MS Paint style poorly-drawn version of a character, like Spooderman."
presale,Presale,Crypto tokens that had a presale event to raise funds.
astrology,Astrology,Crypto tokens that are related to astrology signs like Sagittarius or Virgo.
andrew-tate,Andrew Tate,Crypto tokens that are related to daddy Andrew Tate.
murad-picks,Murad Picks,"This list features the top token picks by @MustStopMurad, a memecoin influencer. (See more at https://x.com/MustStopMurad/status/1845204492414791870)"
zora-creator,Zora Creator,Tokens that are tokenized on Zora for a creator.
zora-content,Zora Content,Tokens that are tokenized on Zora for a social content.
bots,Bots,"Tokens that are related to bots, like Telegram, Discord or Crypto Sniping Bots."
terminal-of-truths,Terminal Of Truths,Tokens mentioned by the terminal of truth at https://x.com/truth_terminal
defi,Defi,"Crypto tokens that are related to DeFi projects, financial liquidity protocols or markets."
sticker,Sticker,Stickers used in chat apps.
prestocks,Prestocks,"PreStocks are tokens that track the valuation of pre-IPO companies.  Fully backed by SPV exposure, and freely tradable 24/7."
with-something,With Something,"Token with something, like with hat and others"
chill,Chill,"Its okay, these crypto tokens are just chill tokens."
clanker-world,Clanker World,Tokens that were created by clanker.world. Clanker.world is an autonomous memecoins machine that launches tokens on Farcaster posts.
virtuals-protocol,Virtuals Protocol,Crypto tokens that were minted from Virtuals Protocol. Virtuals Protocol is building the co-ownership layer for AI agents in gaming and entertainment.
girl,Girl,Tokens related to females especially younger women/ girls
cto,Cto,Tokens that are approved of Community takeover (CTO) on Geckoterminal.
perpetuals-platforms,Perpetuals Platforms,Tokens that are related to perpetual platforms that allows traders to speculate and take leveraged positions on the underlying asset prices indefinitely.
chinese,Chinese,"Tokens that has a Chinese ticker, or translation and relevance."
daosfun-launchpad,Daosfun Launchpad,Daos.fun is a launchpad for a creator-funded smart wallet with special rules that invests on behalf of DAO token holders.
fruits,Fruits,"An apple a day keeps the doctor away, what about other fruits?"
floki,Floki,"Tokens related to Elon Musk's shiba inu dog, named Floki."
influencer,Influencer,Tokens that are related to named after Twitter KOLs or Influencers.
wall-street-bets,Wall Street Bets,Tokens that pay homage to the r/wallstreetbets community.
simply-drawn,Simply Drawn,Crypto tokens that has mascot made with simple or abstract shapes.
nmurad-picks,Nmurad Picks,"This list features the top token picks by @muststopnigg, a memecoin influencer. (See more at https://x.com/muststopnigg/status/1901802031465021503)"
countries,Countries,Tokens that are relevant to country names and places.
in-a-something,In A Something,"Crypto tokens that has something inside a something, usually an animal in a vehicle."
gaming,Gaming,tokens related to gaming projects.
social-experiments,Social Experiments,Crypto tokens that launched with a unique way of experimenting with the community.
mining,Mining,"Tokens that are either proof of work, or let users get a share of their tokens with an activity."
commodities,Commodities,"Crypto tokens and pools that are related to commodities in real life, like Gold, Silver and Diamond."
pepe,Pepe,"All tokens that has the ticker PEPE, or related to PEPE. This category is automatically updated with new PEPE tokens."
digital-fiat-currencies,Digital Fiat Currencies,Tokens that are relevant to crypto-inspired digital currencies of different nations.
hybrid-defi,Hybrid Defi,
nft,Nft,"Tokens that are related to NFTs, or NFT marketplaces."
goat,Goat,Crypto tokens that are related to goats.
reddit,Reddit,"Crypto tokens related to reddit and its mascot. This category is automatically updated with any ""reddit"" token."
wallet,Wallet,Crypto tokens that are related to wallets.
fashion,Fashion,Brands that are related to fashion and clothing.
fictional-character,Fictional Character,"Tokens related to fictional characters from movies, comics, books etc. "
celebrity,Celebrity,Tokens with name or meme that are related or made by celebrities.
tokenized-stocks,Tokenized Stocks,Tokenized stock refers to digital representation of stock on a blockchain platform.
erc404,Erc404,ERC404 is a token standard on Ethereum that combines the attributes of NFTs and fungible tokens.
jail,Jail,The JailVerse: Where each token represents the community's battle cry against crypto's most prominent players.
kabosu-family,Kabosu Family,"Crypto Tokens related to Kabosu, a Shiba Inu dog from Japan known as the Doge meme. This category tracks all Neiro, Kabosu and Ginnan tokens."
founders,Founders,Crypto tokens that are related to founders of products and startups.
dark,Dark,Crypto tokens that have dark profile pictures.
basedotmeme-launchpad,Basedotmeme Launchpad,Tokens launched from base.meme launchpad. (https://base.meme/)
audio-tokens,Audio Tokens,"TON tokens that has audio attached to it, and launched on GasPump."
strategy,Strategy,"Crypto tokens related to social experiment where platforms test out economic model where transaction fees are used to purchase NFTs from the open market, which are then relisted for sale at a higher price."
mcdonalds,Mcdonalds,"Tokens that are related to McDonalds, a fast food chain."
sun-pump,Sun Pump,Crypto tokens that were minted from Sunpump. Sunpump.meme is a platform for token fair-launches on Tron.
arvr,Arvr,"Tokens that are related to Virtual Reality and Augmented Reality, like the Apple Vision Pro."
chains,Chains,Crypto Tokens that has a ticker similar to other chains.
gently-used,Gently Used,gently used things
nftstrategy,Nftstrategy,"NFTStrategy automatically buys and lists floor NFTs for a profit, using the trading fees generated by the tokens.."
wow-launchpad,Wow Launchpad,Tokens that graduated from the wow.xyz launchpad. Wow.xyz is a protocol that allows users to create and interact with meme tokens.
joe-biden,Joe Biden,Tokens that are related to Joe Biden
finance-giants,Finance Giants,Tokens that are related to big financial institutions.
spl22,Spl22,
deep-web,Deep Web,Tokens related to Deep Web
t-on-ton,T On Ton,T something that is launched on Ton
opinionsfun-launchpad,Opinionsfun Launchpad,Tokens launched from Opinions.fun - a launchpad for opinion markets. (https://opinions.fun/)
minecraft,Minecraft,Crypto tokens that are related to minecraft games.
euro-2024,Euro 2024,Tokens related to the Euro 2024 football championship. 
uniderp-launchpad,Uniderp Launchpad,Tokens launched from the uniderp.fun launchpad. 
verb,Verb,"Tokens with name of the english language describing an action, state, or occurrence."