id,name,description
finance-giants,Finance Giants,Tokens that are related to big financial institutions.
jail,Jail,The JailVerse: Where each token represents the community's battle cry against crypto's most prominent players.
unicorn-memechain,Unicorn Memechain,"Crypto tokens that are related to unicorn.memes, the memechain."
taylor-swift,Taylor Swift,"Tokens related to the celebrity, Taylor Swift."
with-something,With Something,"Token with something, like with hat and others"
boopfun-launchpad,Boopfun Launchpad,Tokens launched from the boopfun token launchpad.
psyop-anime,Psyop Anime,Tokens associated with the 'Psyop Anime' trend. Characterized by the fusion of anime aesthetics—often AI-generated—with satirical commentary on global news and market events.
color,Color,Crypto Tokens that has a colour in the name or ticker.
urban-dictionary,Urban Dictionary,Tokens that use abbreviations and slangs we use in real life.
someones-thing,Someones Thing,Things that are owned by popular figures.
strategy,Strategy,"Crypto tokens related to social experiment where platforms test out economic model where transaction fees are used to purchase NFTs from the open market, which are then relisted for sale at a higher price."
prestocks,Prestocks,"PreStocks are tokens that track the valuation of pre-IPO companies.  Fully backed by SPV exposure, and freely tradable 24/7."
flaunch-launchpad,Flaunch Launchpad,Tokens launched from the flaunch launchpad. (https://flaunch.gg/)
doge,Doge,Tokens that are related to Doge the original meme.
district-launchpad,District Launchpad,Tokens launched from the District Launchpad. (https://www.district.xyz/)
commodities,Commodities,"Crypto tokens and pools that are related to commodities in real life, like Gold, Silver and Diamond."
countries,Countries,Tokens that are relevant to country names and places.
spore-fun,Spore Fun,"Tokens that were created by Spore, autonomous AI agent for token reproduction and evolution powered by the Eliza Framework, Solana pump.fun and TEE verifiable computation."
digital-fiat-currencies,Digital Fiat Currencies,Tokens that are relevant to crypto-inspired digital currencies of different nations.
nftstrategy,Nftstrategy,"NFTStrategy automatically buys and lists floor NFTs for a profit, using the trading fees generated by the tokens.."
cat,Cat,Tokens with a cat
arvr,Arvr,"Tokens that are related to Virtual Reality and Augmented Reality, like the Apple Vision Pro."
big-tech,Big Tech,"Crypto Tokens that reference Big Tech Companies, like NVIDIA, AMD or TESLA in comical ways."
food,Food,Tokens that are named after food.
timefun,Timefun,Tokens launched from time.fun launchpad.
gaming,Gaming,tokens related to gaming projects.
whale,Whale,All types of whale tokens. This category is automatically updated with the latest whale tokens.
pump-fun,Pump Fun,Crypto tokens that were minted from Pump.fun. Pump.fun is a platform for token fair-launches with no presale and no team allocation. This list is automatically updated for all latest graduated Pump.fun tokens.
animal,Animal,Tokens that are related to any types of animals
fictional-character,Fictional Character,"Tokens related to fictional characters from movies, comics, books etc. "
ai,Ai,"Tokens related to Artificial Intelligience, Machine Learning and LLMs."
erc404,Erc404,ERC404 is a token standard on Ethereum that combines the attributes of NFTs and fungible tokens.
believeapp-launchpad,Believeapp Launchpad,Tokens launched from Believe.app (https://x.com/believeapp). 
baby,Baby,Tokens that are figuratively small... but mighty
livestream,Livestream,Devs that livestreamed the token creation.
memechan-launchpad,Memechan Launchpad,"Crypto tokens minted from memechan, a launchpad designed to provide a seamless and efficient platform for token creators."
inu,Inu,"Tokens related to Inu or has the name ""Inu"""
dragonball,Dragonball,
opinionsfun-launchpad,Opinionsfun Launchpad,Tokens launched from Opinions.fun - a launchpad for opinion markets. (https://opinions.fun/)
uniderp-launchpad,Uniderp Launchpad,Tokens launched from the uniderp.fun launchpad. 
zora-content,Zora Content,Tokens that are tokenized on Zora for a social content.
pepe,Pepe,"All tokens that has the ticker PEPE, or related to PEPE. This category is automatically updated with new PEPE tokens."
wallet,Wallet,Crypto tokens that are related to wallets.
poorly-drawn,Poorly Drawn,"Tokens with an MS Paint style poorly-drawn version of a character, like Spooderman."
farcaster,Farcaster,"Farcaster does not have an official token, but there are so many tokens created through Farcaster, here are your choices."
cup,Cup,Tokens that are related to cups and mugs.
bonk-flippers,Bonk Flippers,"Crypto Tokens that are Bonk alternatives, or competing with Bonk."
virtuals-protocol,Virtuals Protocol,Crypto tokens that were minted from Virtuals Protocol. Virtuals Protocol is building the co-ownership layer for AI agents in gaming and entertainment.
floki,Floki,"Tokens related to Elon Musk's shiba inu dog, named Floki."
defi,Defi,"Crypto tokens that are related to DeFi projects, financial liquidity protocols or markets."
zora-creator,Zora Creator,Tokens that are tokenized on Zora for a creator.
clanker-world,Clanker World,Tokens that were created by clanker.world. Clanker.world is an autonomous memecoins machine that launches tokens on Farcaster posts.
mcdonalds,Mcdonalds,"Tokens that are related to McDonalds, a fast food chain."
autofun-launchpad,Autofun Launchpad,"Tokens launched from auto.fun launchpad, by the ElizaOS team."
presale,Presale,Crypto tokens that had a presale event to raise funds.
metadao-launchpad,Metadao Launchpad,All tokens that launched from Metadao's ICO program.
goat,Goat,Crypto tokens that are related to goats.
ascii,Ascii,"Crypto tokens that have ascii symbols as tickers or names. Not limited to Japanese Kaomojis, emojis or ascii art."
terminal-of-truths,Terminal Of Truths,Tokens mentioned by the terminal of truth at https://x.com/truth_terminal
dao,Dao,Crypto tokens that are related to DAOs (Decentralised Autonomous Organisations).
cto,Cto,Tokens that are approved of Community takeover (CTO) on Geckoterminal.
nmurad-picks,Nmurad Picks,"This list features the top token picks by @muststopnigg, a memecoin influencer. (See more at https://x.com/muststopnigg/status/1901802031465021503)"
murad-picks,Murad Picks,"This list features the top token picks by @MustStopMurad, a memecoin influencer. (See more at https://x.com/MustStopMurad/status/1845204492414791870)"
acronym,Acronym,Crypto tokens that sounds cooler as an acronym
tiktok-memes,Tiktok Memes,Crypto tokens with memes originated from TikTok or Douyin.
bots,Bots,"Tokens that are related to bots, like Telegram, Discord or Crypto Sniping Bots."
social-experiments,Social Experiments,Crypto tokens that launched with a unique way of experimenting with the community.
dog,Dog,All types of dog tokens. This category is automatically updated with the latest dog tokens.
mining,Mining,"Tokens that are either proof of work, or let users get a share of their tokens with an activity."
the-zoo,The Zoo,Crypto tokens that reference viral zoo animal names.
hybrid-defi,Hybrid Defi,
telegram-apps,Telegram Apps,Crypto tokens that has a telegram app.
wojak,Wojak,"Tokens inspired by the 'Wojak' or 'Feels Guy' character. These projects leverage the meme's long-standing history in internet culture to reflect the highs and lows of the crypto market, often focusing on themes of community, empathy, and trading sentiment."
perpetuals-platforms,Perpetuals Platforms,Tokens that are related to perpetual platforms that allows traders to speculate and take leveraged positions on the underlying asset prices indefinitely.
ai-agents,Ai Agents,Crypto tokens that are related to AI agents on other platforms.
chicken,Chicken,Tokens related to chicken
dark,Dark,Crypto tokens that have dark profile pictures.
fruits,Fruits,"An apple a day keeps the doctor away, what about other fruits?"
celebrity,Celebrity,Tokens with name or meme that are related or made by celebrities.
andrew-tate,Andrew Tate,Crypto tokens that are related to daddy Andrew Tate.
chains,Chains,Crypto Tokens that has a ticker similar to other chains.
letsbonkfun-launchpad,Letsbonkfun Launchpad,"Tokens launched from the letsbonkfun launchpad, https://letsbonk.fun/."
deep-web,Deep Web,Tokens related to Deep Web
wall-street-bets,Wall Street Bets,Tokens that pay homage to the r/wallstreetbets community.
numbers,Numbers,"Crypto tokens inspired by internet subcultures and number-based wordplay. These projects utilize viral numerical sequences, such as 114514 and 45470, to foster shared identity and signaling through niche online humor and cultural symbolism."
the-boys-club,The Boys Club,"Tokens that are related to the members of The Boys Club by Matt Furie. Including Pepe, Brett, Andy and Landwolf."
artist-tokens,Artist Tokens,Tokens that are created by internet artists.
sol-tech,Sol Tech,"Crypto tokens that envisions an additional layer of utility to Solana and starts with ""Sol"""
nft,Nft,"Tokens that are related to NFTs, or NFT marketplaces."
elon,Elon,Things and Brands related to Elon Musk
resistance,Resistance,Tokens related to digital resistance
audio-tokens,Audio Tokens,"TON tokens that has audio attached to it, and launched on GasPump."
archives,Archives,"Tokens that belong to projects that are archiving information, like Magazines and Books."
meme,Meme,Tokens that are memes or related to meme images.
in-a-something,In A Something,"Crypto tokens that has something inside a something, usually an animal in a vehicle."
basedotmeme-launchpad,Basedotmeme Launchpad,Tokens launched from base.meme launchpad. (https://base.meme/)
kabosu-family,Kabosu Family,"Crypto Tokens related to Kabosu, a Shiba Inu dog from Japan known as the Doge meme. This category tracks all Neiro, Kabosu and Ginnan tokens."
fourmeme-launchpad,Fourmeme Launchpad,Tokens launched on four.meme launchpad. 
daosfun-launchpad,Daosfun Launchpad,Daos.fun is a launchpad for a creator-funded smart wallet with special rules that invests on behalf of DAO token holders.
influencer,Influencer,Tokens that are related to named after Twitter KOLs or Influencers.
ape,Ape,Tokens related to the great apes 
religion,Religion,Tokens that are related to religious vocabularies.
chill,Chill,"Its okay, these crypto tokens are just chill tokens."
sun-pump,Sun Pump,Crypto tokens that were minted from Sunpump. Sunpump.meme is a platform for token fair-launches on Tron.
tokenized-stocks,Tokenized Stocks,Tokenized stock refers to digital representation of stock on a blockchain platform.
donald-trump,Donald Trump,Tokens related to Donald Trump
us-presidential-election-2024,Us Presidential Election 2024,"Tokens related to US presidential candidates, primarily Trump vs Biden."
trading-card-game,Trading Card Game,Tokens related to the trading card game meta.
japanese,Japanese,"Crypto tokens that has a japanese ticker, or a relevance to japanese culture."
long-launchpad,Long Launchpad,
hamster,Hamster,"As requested by the community, here are the crypto hamsters"
desci,Desci,"Tokens that are related to DeSci, or Decentralised Science."
euro-2024,Euro 2024,Tokens related to the Euro 2024 football championship. 
ghibli-themed,Ghibli Themed,"Tokens has Studio Ghibli themed style artwork. Recent AI advancement has made the iconic Studio Ghibli animation style available through AI image generation, which led to a viral trend on social media."
long-things,Long Things,"Crypto tokens that are longer than the rest, starts with ""long""."
plane,Plane,Tokens that are related to airplanes and flights.
joe-biden,Joe Biden,Tokens that are related to Joe Biden
x402-protocol,X402 Protocol,"Projects using the x402 protocol, where AI agents can buy, sell, and pay each other without any human in the loop."
spl22,Spl22,
milady,Milady,Crypto tokens that are related to Milady Maker or spinoffs counterparts.
astrology,Astrology,Crypto tokens that are related to astrology signs like Sagittarius or Virgo.
chinese,Chinese,"Tokens that has a Chinese ticker, or translation and relevance."
mascot,Mascot,"Tokens with a unique mascot. This category is automatically updated with all latest ""mascot"" crypto tokens."
girl,Girl,Tokens related to females especially younger women/ girls
sticker,Sticker,Stickers used in chat apps.
creatorbid-launchpad,Creatorbid Launchpad,Creator.bid is a launchpad that allows you to create and tokenize AI agents on Base.
reddit,Reddit,"Crypto tokens related to reddit and its mascot. This category is automatically updated with any ""reddit"" token."
fashion,Fashion,Brands that are related to fashion and clothing.
binance-exclusive,Binance Exclusive,Tokens that are launched from Binance Wallet Exclusive launchpad. These tokens can only be traded using Binance wallet before they graduate from the bonding curve.
founders,Founders,Crypto tokens that are related to founders of products and startups.
simply-drawn,Simply Drawn,Crypto tokens that has mascot made with simple or abstract shapes.
anime,Anime,Tokens that are related to Japanese cartoons or anime
trends-launchpad,Trends Launchpad,Tokens launched from Trends.fun launchpad for the capitalized information market. https://trends.fun
justice-themed,Justice Themed,Tokens that are made to bring social justice.
gently-used,Gently Used,gently used things
sei-pun,Sei Pun,"Puns with the sound ""Sei"""
kamala-harris,Kamala Harris,Tokens related to Kamala Harris
harry-potter,Harry Potter,Tokens that are related to the Harry Potter book series.
verb,Verb,"Tokens with name of the english language describing an action, state, or occurrence."
minecraft,Minecraft,Crypto tokens that are related to minecraft games.